"type";"question";"complexity";"saf";"nli";"sim";"response_llm";"model"
"grafo";"A empresa pode continuar me mandando e-mail de marketing após eu pedir para sair da lista?";"0.77";"0.96";"1.00";"0.66";"{'resposta': 'Após o titular solicitar a exclusão da lista de e-mails de marketing, a empresa deve cessar o envio, pois a LGPD obriga o término do tratamento mediante comunicação do titular, conforme art. 15, III. O envio após o pedido viola o direito de revogação do consentimento.', 'resposta_completa': ""A legislação de proteção de dados pessoais (LGPD) determina que o tratamento de dados pessoais deve ser encerrado quando o titular comunica sua vontade, inclusive exercendo o direito de revogação do consentimento. O art. 15, III, da LGPD, estabelece que o término do tratamento ocorre mediante comunicação do titular, resguardado o interesse público. Portanto, se o titular dos dados solicita a exclusão da lista de e-mails de marketing, a empresa é obrigada a cessar o envio dessas comunicações. O envio contínuo após o pedido caracteriza tratamento em desconformidade com a lei, podendo gerar sanções administrativas e obrigação de reparação de danos. O trecho-chave que fundamenta essa resposta é: 'comunicação do titular, inclusive no exercício de seu direito de revogação do consentimento conforme disposto no § 5º do art. 8º desta Lei, resguardado o interesse público'."", 'chunks': ['2c784e52'], 'trecho_chave': 'comunicação do titular, inclusive no exercício de seu direito de revogação do consentimento conforme disposto no § 5º do art. 8º desta Lei, resguardado o interesse público', 'percentual': ['100']}";"maritaca"
"grafo";"O cartão de fidelidade de supermercado pode mapear todos os meus hábitos de consumo?";"0.90";"0.87";"0.54";"0.46";"{'resposta': 'O uso do cartão de fidelidade em supermercados permite o mapeamento de hábitos de consumo, pois envolve coleta, classificação e armazenamento de dados pessoais vinculados às compras. O titular tem direito ao acesso facilitado sobre o tratamento desses dados, conforme a LGPD.', 'resposta_completa': 'O cartão de fidelidade de supermercado pode, sim, mapear todos os seus hábitos de consumo, pois cada transação realizada com o cartão gera dados pessoais que são coletados, classificados e armazenados pelo supermercado, que atua como agente de tratamento. Segundo a LGPD, tais dados são considerados pessoais e seu tratamento deve ser transparente, com o titular tendo direito ao acesso facilitado às informações sobre a finalidade, forma e duração do tratamento, bem como sobre o uso compartilhado dos dados. O trecho-chave da legislação destaca que o titular deve ser informado de maneira clara e adequada sobre o tratamento de seus dados, incluindo a finalidade específica e os responsáveis pelo tratamento. Assim, o monitoramento e análise de preferências e padrões de compra são possíveis, mas devem respeitar os direitos do titular previstos na LGPD.', 'chunks': ['ffc54078', 'e9106279'], 'trecho_chave': 'Art. 9º O titular tem direito ao acesso facilitado às informações sobre o tratamento de seus dados, que deverão ser disponibilizadas de forma clara, adequada e ostensiva acerca de, entre outras características [...] finalidade específica do tratamento [...]', 'percentual': ['60', '40']}";"maritaca"
"grafo";"Posso ser cobrado por serviços a mais se não aceitar o compartilhamento dos meus dados?";"0.86";"0.93";"0.67";"0.56";"{'resposta': 'A legislação exige que o controlador informe ao titular sobre a possibilidade de não fornecer consentimento e as consequências da negativa, mas não autoriza cobrança adicional ou discriminação por recusa ao compartilhamento de dados pessoais. Trecho-chave: ""informação sobre a possibilidade de não fornecer consentimento e sobre as consequências da negativa"".', 'resposta_completa': 'No contexto condominial, a Lei Geral de Proteção de Dados (LGPD) determina que o titular dos dados pessoais deve ser informado sobre a possibilidade de não fornecer consentimento para o compartilhamento de seus dados e sobre as consequências dessa negativa. Contudo, a legislação não prevê a possibilidade de cobrança adicional ou discriminação caso o titular opte por não consentir com o compartilhamento de seus dados pessoais. O controlador deve garantir os direitos fundamentais do titular, como liberdade, intimidade e privacidade, e não pode impor sanções ou tarifas diferenciadas em razão da recusa ao consentimento. Portanto, não há respaldo legal para cobrança extra por serviços condominiais em razão da negativa ao compartilhamento de dados pessoais.', 'chunks': ['f9e4ad69'], 'trecho_chave': 'informação sobre a possibilidade de não fornecer consentimento e sobre as consequências da negativa', 'percentual': ['100']}";"maritaca"
"grafo";"Posso usar a foto de perfil do Facebook de alguém para criar um meme?";"0.90";"0.78";"0.54";"0.71";"{'resposta': 'A utilização da foto de perfil do Facebook de terceiros para criar memes configura tratamento de dado pessoal, exigindo consentimento do titular, conforme o conceito de dado pessoal e consentimento previsto na LGPD. O respeito à privacidade e à imagem é fundamento legal.', 'resposta_completa': 'A foto de perfil do Facebook é considerada dado pessoal, pois permite identificar a pessoa natural (art. 5º, I, LGPD). O tratamento desse dado, como a criação e divulgação de memes, só pode ocorrer mediante consentimento livre, informado e inequívoco do titular (art. 5º, XII, LGPD). O uso sem autorização pode violar direitos fundamentais de privacidade, intimidade e imagem, protegidos pela legislação (art. 2º, IV, LGPD). Exceções à necessidade de consentimento existem apenas para fins jornalísticos, artísticos ou acadêmicos, o que não se aplica genericamente à criação de memes. Portanto, a reutilização da imagem sem consentimento pode gerar responsabilidade civil e administrativa.', 'chunks': ['e9106279', '941201b9'], 'trecho_chave': 'I - dado pessoal: informação relacionada a pessoa natural identificada ou identificável; ... XII - consentimento: manifestação livre, informada e inequívoca pela qual o titular concorda com - tratamento de seus dados pessoais para uma finalidade determinada;', 'percentual': ['60', '40']}";"maritaca"
"grafo";"Uma empresa pode me mandar mensagem no WhatsApp sem eu ter dado meu número a ela?";"0.75";"0.97";"0.54";"0.63";"{'resposta': 'O envio de mensagem por empresa via WhatsApp sem consentimento do titular pode configurar tratamento de dado pessoal em desconformidade com a LGPD. O titular tem direito à confirmação da existência de tratamento e à eliminação dos dados, conforme art. 18 da Lei.', 'resposta_completa': 'O envio de mensagens por empresa no WhatsApp, utilizando número de telefone sem consentimento do titular, caracteriza tratamento de dado pessoal. Segundo o art. 18 da LGPD, o titular pode exigir confirmação da existência de tratamento, acesso, correção, anonimização, bloqueio ou eliminação dos dados tratados em desconformidade. O tratamento de dados pessoais por empresas exige base legal, sendo o consentimento uma das principais hipóteses. Caso não haja consentimento ou outra base legal legítima, o envio de mensagens pode ser considerado irregular, sujeitando a empresa a sanções e obrigações de reparação. O titular pode ainda solicitar informações sobre o compartilhamento dos dados e revogar eventual consentimento concedido.', 'chunks': ['f9e4ad69'], 'trecho_chave': 'Art. 18 O titular dos dados pessoais tem direito a obter do controlador, em relação aos dados do titular por ele tratados, a qualquer momento e mediante requisição: I - confirmação da existência de tratamento; [...] IV - anonimização, bloqueio ou eliminação de dados desnecessários, excessivos ou tratados em desconformidade com o disposto nesta Lei;'}";"maritaca"
"grafo";"O Google pode guardar meu histórico de pesquisas para sempre?";"0.82";"0.67";"0.80";"0.68";"{'resposta': 'O Google, como controlador, pode armazenar o histórico de pesquisas do usuário por tempo indefinido, mas a LGPD garante ao titular o direito de solicitar a eliminação desses dados. O trecho-chave: ""eliminação dos dados pessoais tratados com o consentimento do titular"" fundamenta esse direito.', 'resposta_completa': 'O Google, na qualidade de controlador de dados, pode armazenar o histórico de pesquisas do usuário em seus servidores para fins de personalização, publicidade e melhoria dos serviços. Contudo, conforme a Lei Geral de Proteção de Dados (LGPD), o titular tem o direito de solicitar a eliminação dos dados pessoais tratados com seu consentimento, salvo exceções legais. O artigo 18 da LGPD prevê expressamente que o titular pode, a qualquer momento, requerer a eliminação dos dados pessoais, o que impede o armazenamento permanente caso haja solicitação. Portanto, a permanência dos dados não é absoluta, pois depende da vontade do titular, que pode exercer seus direitos previstos na legislação.', 'chunks': ['f9e4ad69', 'e9106279'], 'trecho_chave': 'eliminação dos dados pessoais tratados com o consentimento do titular, exceto nas hipóteses previstas no art. 16 desta Lei', 'percentual': ['80', '20']}";"maritaca"
"grafo";"Posso ser demitido por postagens no meu perfil pessoal do Instagram fora do horário de trabalho?";"0.72";"0.96";"0.51";"0.51";"{'resposta': 'Não há regra explícita nos chunks apresentados que trate da possibilidade de demissão por postagens em perfil pessoal do Instagram fora do horário de trabalho. Os trechos disponíveis abordam tratamento de dados pessoais, direitos do titular e princípios da LGPD, sem tratar de vínculo empregatício ou conduta em redes sociais.', 'resposta_completa': 'A análise dos chunks fornecidos revela que não há base normativa específica sobre a possibilidade de demissão por postagens em perfil pessoal do Instagram fora do horário de trabalho. Os textos apresentados concentram-se em princípios da Lei Geral de Proteção de Dados (LGPD), como finalidade, necessidade, transparência e não discriminação, além de direitos do titular sobre seus dados pessoais. Não há menção a regras trabalhistas, conduta do empregado fora do expediente ou consequências disciplinares relacionadas a postagens em redes sociais. Portanto, com base apenas nos chunks apresentados, não é possível afirmar que existe respaldo legal para demissão nessas circunstâncias, sendo necessário consultar legislação trabalhista específica ou normas internas da empresa para uma resposta conclusiva.', 'chunks': ['9c7da499', 'e9106279'], 'trecho_chave': 'As atividades de tratamento de dados pessoais deverão observar a boa-fé e os seguintes princípios: I - finalidade: realização do tratamento para propósitos legítimos, específicos, explícitos e informados ao titular [...] IX - não discriminação: impossibilidade de realização do tratamento para fins discriminatórios ilícitos ou abusivos;', 'percentual': ['60', '40']}";"maritaca"
"grafo";"Uma pessoa pode me fotografar na rua e vender a foto para um banco de imagens?";"0.83";"0.83";"1.00";"0.89";"{'resposta': 'A captação e comercialização de imagem pessoal, mesmo em via pública, depende de consentimento do titular, pois a imagem é dado pessoal protegido pela LGPD. O tratamento sem consentimento viola o direito à privacidade e à autodeterminação informativa. Trecho-chave: ""manifestação livre, informada e inequívoca pela qual o titular concorda com tratamento de seus dados pessoais para uma finalidade determinada"".', 'resposta_completa': 'A fotografia de uma pessoa em via pública e a posterior venda dessa imagem para um banco de imagens caracteriza tratamento de dado pessoal, conforme o art. 5º da LGPD, pois envolve coleta e comercialização de informação relacionada a pessoa identificável. O uso comercial da imagem exige consentimento do titular, conforme o conceito de consentimento previsto na LGPD. O direito à privacidade, à autodeterminação informativa e à inviolabilidade da imagem são fundamentos expressos da proteção de dados pessoais (art. 2º). Assim, a exploração comercial da imagem sem consentimento viola esses direitos, mesmo que a foto tenha sido tirada em local público. O titular pode exigir a eliminação dos dados e buscar reparação por danos. Exceções legais, como fins jornalísticos ou artísticos, não se aplicam ao caso de venda comercial para banco de imagens.', 'chunks': ['e9106279', '941201b9'], 'trecho_chave': 'manifestação livre, informada e inequívoca pela qual o titular concorda com tratamento de seus dados pessoais para uma finalidade determinada', 'percentual': ['70', '30']}";"maritaca"
"grafo";"O site pode usar cookies para rastrear minha navegação sem me avisar?";"0.78";"0.48";"0.99";"0.73";"{'resposta': 'O site não pode usar cookies para rastrear sua navegação sem aviso. O tratamento de dados exige transparência e consentimento do titular, conforme art. 6º e art. 18 da LGPD. O controlador deve informar claramente sobre o uso de cookies e obter consentimento prévio.', 'resposta_completa': 'A utilização de cookies para rastreamento durante a navegação configura tratamento de dados pessoais. Segundo o art. 6º da LGPD, o tratamento deve observar os princípios da finalidade, necessidade e, principalmente, transparência, garantindo informações claras e acessíveis ao titular. O art. 18 reforça que o titular tem direito à confirmação da existência de tratamento, acesso aos dados e informação sobre a possibilidade de não fornecer consentimento. Portanto, o controlador do site deve informar de forma clara sobre o uso de cookies e obter consentimento do usuário antes de iniciar o rastreamento, não sendo permitido fazê-lo sem aviso.', 'chunks': ['9c7da499', 'f9e4ad69'], 'trecho_chave': 'garantia, aos titulares, de informações claras, precisas e facilmente acessíveis sobre a realização do tratamento e os respectivos agentes de tratamento', 'percentual': ['60', '40']}";"maritaca"
"grafo";"Posso pedir para o Google remover resultados de pesquisa com meu nome?";"0.88";"0.78";"0.56";"0.84";"{'resposta': 'O titular dos dados pessoais pode solicitar ao Google a remoção de resultados de pesquisa que contenham seus dados pessoais, fundamentando-se no direito de eliminação previsto na LGPD. O artigo 18 garante ao titular o direito de requerer a eliminação de dados tratados em desconformidade.', 'resposta_completa': 'A Lei Geral de Proteção de Dados (LGPD) assegura ao titular dos dados pessoais o direito de solicitar a eliminação de informações pessoais tratadas de forma inadequada ou em desconformidade com a legislação. O artigo 18 da LGPD prevê expressamente que o titular pode requerer ao controlador, neste caso o Google, a eliminação de dados pessoais, especialmente quando o tratamento for considerado desnecessário, excessivo ou em desacordo com a lei. Para exercer esse direito, é necessário realizar uma solicitação formal ao Google, indicando os resultados de pesquisa que contenham seus dados pessoais e fundamentando o pedido no direito de eliminação. O Google disponibiliza um canal específico para esse tipo de solicitação, sem custo ao titular. A análise do pedido será feita conforme os critérios legais e a política da plataforma.', 'chunks': ['f9e4ad69', 'e9106279'], 'trecho_chave': 'Art. 18 O titular dos dados pessoais tem direito a obter do controlador... IV - anonimização, bloqueio ou eliminação de dados desnecessários, excessivos ou tratados em desconformidade com o disposto nesta Lei;', 'percentual': ['80', '20']}";"maritaca"
"grafo";"Uma escola pode criar grupo de WhatsApp com fotos e dados dos alunos sem pedir autorização dos pais?";"0.85";"0.76";"0.54";"0.63";"{'resposta': 'A escola, como agente de tratamento, não pode criar grupo de WhatsApp com fotos e dados dos alunos sem o consentimento dos pais ou responsáveis, pois o compartilhamento de dados pessoais exige manifestação livre, informada e inequívoca do titular. O consentimento é obrigatório.', 'resposta_completa': 'A criação de grupo de WhatsApp por escola, contendo fotos e dados dos alunos, caracteriza tratamento de dados pessoais, conforme art. 5º da LGPD. O compartilhamento desses dados exige consentimento dos pais ou responsáveis, pois alunos são titulares e a escola é agente de tratamento. O consentimento deve ser livre, informado e inequívoco, conforme definição legal. O descumprimento pode acarretar sanções administrativas, como advertência, multa e bloqueio dos dados, conforme art. 52 da LGPD. Portanto, a escola deve obter autorização expressa dos pais antes de compartilhar fotos e dados dos alunos em grupos de WhatsApp.', 'chunks': ['e9106279', '28e2924f'], 'trecho_chave': 'consentimento: manifestação livre, informada e inequívoca pela qual o titular concorda com - tratamento de seus dados pessoais para uma finalidade determinada'}";"maritaca"
"grafo";"O governo pode cruzar meus dados do IR com dados do INSS sem minha autorização?";"0.70";"0.64";"0.55";"0.82";"{'resposta': 'O governo federal, por meio da Receita Federal e INSS, pode cruzar dados do Imposto de Renda e INSS sem autorização do titular, desde que para cumprimento de obrigação legal ou execução de políticas públicas, conforme art. 7º, II e III da LGPD. O tratamento deve ser informado e justificado.', 'resposta_completa': 'A Lei Geral de Proteção de Dados (LGPD) permite que órgãos públicos, como Receita Federal e INSS, realizem o cruzamento de dados pessoais, inclusive do Imposto de Renda e INSS, sem necessidade de autorização do titular, desde que haja fundamento legal. O art. 7º, II e III, da LGPD, autoriza o tratamento de dados pessoais para cumprimento de obrigação legal ou regulatória pelo controlador e para execução de políticas públicas previstas em leis e regulamentos. O art. 23 reforça que o tratamento deve atender à finalidade pública, interesse público e execução de competências legais, devendo ser informadas as hipóteses, finalidades e procedimentos em veículos de fácil acesso. Assim, o cruzamento de dados para fins de fiscalização, verificação ou cumprimento de obrigações legais é permitido, desde que respeitados os princípios da transparência e finalidade.', 'chunks': ['a57ec09b', 'a625792a'], 'trecho_chave': 'Art. 7º O tratamento de dados pessoais somente poderá ser realizado nas seguintes hipóteses: II - para o cumprimento de obrigação legal ou regulatória pelo controlador; III - pela administração pública, para o tratamento e uso compartilhado de dados necessários à execução de políticas públicas previstas em leis e regulamentos', 'percentual': ['70', '30']}";"maritaca"
"grafo";"A prefeitura pode divulgar meu nome e valor de IPTU em dívida no site oficial?";"0.70";"0.83";"0.55";"0.68";"{'resposta': 'A divulgação do nome e valor de IPTU em dívida pela prefeitura em site oficial envolve tratamento de dados pessoais, que deve respeitar direitos fundamentais de liberdade, intimidade e privacidade, conforme previsto na legislação. O uso desses dados deve ser justificado por obrigação legal ou regulatória, e a publicidade deve observar limites e princípios da proteção de dados pessoais, conforme art. 23 e art. 27 da Lei Geral de Proteção de Dados (LGPD).', 'resposta_completa': 'A divulgação do nome e valor de IPTU em dívida ativa pela prefeitura em seu site oficial configura tratamento de dados pessoais, pois envolve informações identificáveis do titular. Segundo a LGPD, o tratamento de dados pelo poder público deve respeitar direitos fundamentais de liberdade, intimidade e privacidade (art. 23 e art. 27). A publicidade desses dados pode ser permitida quando fundamentada em obrigação legal ou regulatória, mas deve ser limitada ao estritamente necessário e observar os princípios da proteção de dados. O compartilhamento ou divulgação deve ser informado à autoridade nacional e, salvo exceções legais, depende de consentimento do titular. Portanto, a prefeitura só pode divulgar tais informações se houver previsão legal expressa e observância dos princípios da LGPD, evitando exposição excessiva ou desnecessária dos dados pessoais do devedor.', 'chunks': ['4d9abb51', '898ad7f0'], 'trecho_chave': 'Garantir ao titular os direitos fundamentais de liberdade, intimidade e privacidade. [...] nos casos de uso compartilhado de dados, em que será dada publicidade nos termos do inciso I do caput do art. 23 desta Lei', 'percentual': ['70', '30']}";"maritaca"
"grafo";"Posso pedir para o Detran apagar minha multa do sistema?";"0.60";"0.64";"0.55";"0.73";"{'resposta': 'A solicitação de eliminação de registro de multa do sistema do Detran não é aplicável, pois a conservação desses dados é permitida para cumprimento de obrigação legal ou regulatória, conforme previsto na legislação. O Detran mantém o registro da penalidade para garantir a execução das normas de trânsito.', 'resposta_completa': 'O pedido para que o Detran apague uma multa do sistema não encontra respaldo legal, pois a legislação permite a conservação de dados pessoais para cumprimento de obrigação legal ou regulatória pelo controlador, neste caso, o Detran. O registro da penalidade é necessário para garantir a execução das normas de trânsito e a efetividade das sanções administrativas. A eliminação de dados pessoais só é obrigatória quando não houver mais finalidade legítima ou obrigação legal para sua manutenção, o que não se aplica às multas de trânsito, que são registradas para fins de controle e fiscalização. Portanto, mesmo mediante requerimento formal, não é possível eliminar a multa do sistema do Detran enquanto houver obrigação legal de manter esse registro.', 'chunks': ['5cf8dbf1'], 'trecho_chave': 'Permissão de conservação de dados pessoais para cumprimento de obrigação legal ou regulatória pelo controlador', 'percentual': ['100']}";"maritaca"
"grafo";"O hospital público pode compartilhar meu prontuário com pesquisadores sem minha autorização?";"0.87";"0.75";"0.60";"0.81";"{'resposta': 'O hospital público pode compartilhar prontuário médico com pesquisadores para estudos em saúde pública, desde que os dados sejam tratados exclusivamente para pesquisa, mantidos em ambiente seguro e, sempre que possível, anonimizados. Trecho-chave: ""órgãos de pesquisa poderão ter acesso a bases de dados pessoais... mantidos em ambiente controlado e seguro... sempre que possível, a anonimização"".', 'resposta_completa': 'O compartilhamento de prontuário médico por hospital público com pesquisadores é permitido para fins de estudos em saúde pública, conforme previsto no art. 13 da LGPD. Os dados devem ser tratados exclusivamente dentro do órgão de pesquisa, para a finalidade de realização de estudos e pesquisas, e mantidos em ambiente controlado e seguro, conforme práticas de segurança previstas em regulamento específico. Sempre que possível, deve ser garantida a anonimização ou pseudonimização dos dados, além da observância dos padrões éticos relacionados a estudos e pesquisas. Portanto, a autorização do titular não é obrigatória se respeitadas essas condições, especialmente a anonimização dos dados.', 'chunks': ['bfc17de8', 'a57ec09b'], 'trecho_chave': 'órgãos de pesquisa poderão ter acesso a bases de dados pessoais... mantidos em ambiente controlado e seguro... sempre que possível, a anonimização', 'percentual': ['80', '20']}";"maritaca"
"grafo";"A escola pública pode exigir foto do aluno para matrícula?";"0.86";"0.92";"0.54";"0.65";"{'resposta': 'A exigência de foto do aluno para matrícula em escola pública pode ser admitida se houver previsão legal, finalidade pública clara e informação transparente ao responsável, conforme art. 23 da LGPD. O tratamento deve respeitar direitos e garantir segurança dos dados pessoais.', 'resposta_completa': 'A escola pública pode solicitar foto do aluno para matrícula desde que atenda aos requisitos da Lei Geral de Proteção de Dados (LGPD). O art. 23 da LGPD determina que o tratamento de dados pessoais por órgãos públicos deve ser realizado para finalidade pública, com informações claras sobre a previsão legal, finalidade, procedimentos e práticas utilizadas. Além disso, a escola deve garantir a segurança dos dados e indicar um encarregado pelo tratamento. Caso a foto seja considerada dado sensível, o art. 11 da LGPD permite o tratamento para cumprimento de obrigação legal ou regulatória, execução de políticas públicas ou mediante consentimento específico do responsável legal. Portanto, a exigência é possível, desde que fundamentada, transparente e em conformidade com a legislação.', 'chunks': ['a625792a', 'b47f4387']}";"maritaca"
